{
	"$schema": "https://raw.githubusercontent.com/kolisachint/hoocode-ts/main/packages/coding-agent/src/modes/interactive/theme/theme-schema.json",
	"name": "daylight",
	"description": "Mission Control daylight paper-white cockpit",
	"vars": {
		"accent": "#0a8a91",
		"cyan": "#0a8a91",
		"vio": "#5b4bd1",
		"ink": "#141a2e",
		"gray": "#5d6684",
		"dimGray": "#5d6684",
		"lightGray": "#b0b6c9",
		"green": "#2f8a3a",
		"red": "#d23355",
		"yellow": "#b26a00",
		"gold": "#b88a00",
		"magenta": "#b0307e",
		"edge": "#dde1ee",
		"kw": "#5b4bd1",
		"str": "#2f8a3a",
		"ty": "#9a6a00",
		"num": "#9a6a00",
		"com": "#a0a7bd",
		"fn": "#0a6f75",
		"selectedBg": "#e2e6f4",
		"userMsgBg": "#ecebfb",
		"customMsgBg": "#f1ebfb",
		"toolPendingBg": "#eff1f8",
		"toolBandBg": "#eceff7",
		"toolSuccessBg": "#e3f3e2",
		"toolErrorBg": "#fbe3e8",
		"warningBg": "#fae3a3"
	},
	"colors": {
		"accent": "accent",
		"border": "edge",
		"borderAccent": "cyan",
		"borderMuted": "lightGray",
		"success": "green",
		"error": "red",
		"warning": "yellow",
		"muted": "gray",
		"dim": "dimGray",
		"text": "ink",
		"thinkingText": "dimGray",
		"selectedBg": "selectedBg",
		"userMessageBg": "userMsgBg",
		"userMessageText": "ink",
		"customMessageBg": "customMsgBg",
		"customMessageText": "ink",
		"customMessageLabel": "vio",
		"toolPendingBg": "toolPendingBg",
		"toolSuccessBg": "toolSuccessBg",
		"toolErrorBg": "toolErrorBg",
		"toolBandBg": "toolBandBg",
		"warningBg": "warningBg",
		"toolTitle": "",
		"toolOutput": "gray",
		"mdHeading": "gold",
		"mdLink": "cyan",
		"mdLinkUrl": "dimGray",
		"mdCode": "accent",
		"mdCodeBlock": "ink",
		"mdCodeBlockBorder": "lightGray",
		"mdQuote": "gray",
		"mdQuoteBorder": "gold",
		"mdHr": "lightGray",
		"mdListBullet": "accent",
		"toolDiffAdded": "green",
		"toolDiffRemoved": "red",
		"toolDiffContext": "gray",
		"syntaxComment": "com",
		"syntaxKeyword": "kw",
		"syntaxFunction": "fn",
		"syntaxVariable": "cyan",
		"syntaxString": "str",
		"syntaxNumber": "num",
		"syntaxType": "ty",
		"syntaxOperator": "ink",
		"syntaxPunctuation": "dimGray",
		"thinkingOff": "lightGray",
		"thinkingMinimal": "dimGray",
		"thinkingLow": "vio",
		"thinkingMedium": "accent",
		"thinkingHigh": "yellow",
		"thinkingXhigh": "magenta",
		"bashMode": "green",
		"agent1": "#0b6e80",
		"agent2": "#8e24aa",
		"agent3": "#7b6006",
		"agent4": "#b01e51",
		"agent5": "#0c6330",
		"agent6": "#2544c9",
		"mcp": "#300c6e",
		"ink": "ink",
		"faint": "lightGray",
		"acc": "accent",
		"ok": "green",
		"err": "red",
		"warn": "yellow",
		"you": "vio",
		"vio": "vio",
		"gold": "gold"
	},
	"export": {
		"pageBg": "#f7f8fc",
		"cardBg": "#ffffff",
		"infoBg": "#e6e9f3"
	}
}
