{
	"$schema": "https://raw.githubusercontent.com/kolisachint/hoocode/main/packages/coding-agent/src/modes/interactive/theme/theme-schema.json",
	"name": "vox-light",
	"description": "Explanatory-journalism ink on cream; the yellow survives as the highlighter and the footer brand chip",
	"vars": {
		"ink": "#141209",
		"amber": "#8a5a00",
		"yellow": "#ffe600",
		"orange": "#a34a00",
		"green": "#186b34",
		"red": "#a81c0c",
		"blue": "#1046b4",
		"teal": "#0d5c58",
		"purple": "#6b2d8f",
		"muted": "#4a4638",
		"dim": "#6a6555",
		"rule": "#948a6c",
		"ruleMuted": "#b9b19a",
		"selectedBg": "#ffef9e",
		"userMsgBg": "#fdf8e6",
		"customMsgBg": "#f6f0fa",
		"toolPendingBg": "#fbf8ee",
		"toolSuccessBg": "#eff7ee",
		"toolErrorBg": "#fdefec"
	},
	"colors": {
		"accent": "amber",
		"border": "rule",
		"borderAccent": "amber",
		"borderMuted": "ruleMuted",
		"success": "green",
		"error": "red",
		"warning": "orange",
		"muted": "muted",
		"dim": "dim",
		"text": "ink",
		"thinkingText": "muted",

		"selectedBg": "selectedBg",
		"userMessageBg": "userMsgBg",
		"userMessageText": "ink",
		"customMessageBg": "customMsgBg",
		"customMessageText": "ink",
		"customMessageLabel": "purple",
		"toolPendingBg": "toolPendingBg",
		"toolSuccessBg": "toolSuccessBg",
		"toolErrorBg": "toolErrorBg",
		"toolTitle": "ink",
		"toolOutput": "muted",

		"mdHeading": "amber",
		"mdLink": "blue",
		"mdLinkUrl": "dim",
		"mdCode": "teal",
		"mdCodeBlock": "#2e6b3a",
		"mdCodeBlockBorder": "rule",
		"mdQuote": "muted",
		"mdQuoteBorder": "rule",
		"mdHr": "rule",
		"mdListBullet": "amber",

		"toolDiffAdded": "green",
		"toolDiffRemoved": "red",
		"toolDiffContext": "dim",

		"syntaxComment": "#2e6b3a",
		"syntaxKeyword": "#1a4b8f",
		"syntaxFunction": "#6b4a00",
		"syntaxVariable": "#3a2d6b",
		"syntaxString": "#8f2a10",
		"syntaxNumber": "#1a5c2e",
		"syntaxType": "teal",
		"syntaxOperator": "#2b2822",
		"syntaxPunctuation": "#2b2822",

		"thinkingOff": "#9a9484",
		"thinkingMinimal": "#7a7566",
		"thinkingLow": "#3a5f9f",
		"thinkingMedium": "#1a4b8f",
		"thinkingHigh": "#6b2d8f",
		"thinkingXhigh": "#8f1f7a",

		"bashMode": "green",

		"agent1": "teal",
		"agent2": "purple",
		"agent3": "#7a4d00",
		"agent4": "#a3145e",
		"agent5": "green",
		"agent6": "blue",
		"mcp": "#5b2b8a",

		"brandBg": "ink",
		"brandText": "yellow"
	},
	"export": {
		"pageBg": "#fffdf5",
		"cardBg": "#ffffff",
		"infoBg": "#fff3a8"
	}
}
