{
	"$schema": "https://raw.githubusercontent.com/kolisachint/hoocode/main/packages/coding-agent/src/modes/interactive/theme/theme-schema.json",
	"name": "warm-light",
	"description": "Low vision: dark ink on warm paper, less glare than pure white",
	"vars": {
		"ink": "#2b1d0e",
		"inkSoft": "#3a2a18",
		"bark": "#241d14",
		"clay": "#4c4034",
		"brown": "#6b3a00",
		"rust": "#8a0f14",
		"forest": "#224a17",
		"teal": "#0d4d49",
		"amber": "#514608",
		"plum": "#5c2a5e",
		"indigo": "#1f3f8f",
		"selectedBg": "#eee0c4",
		"userMsgBg": "#faf3e3",
		"customMsgBg": "#f9f0ea",
		"toolPendingBg": "#fbf6ea",
		"toolSuccessBg": "#f2f6e6",
		"toolErrorBg": "#fdefe8",
		"warningBg": "#e4e1d2"
	},
	"colors": {
		"accent": "brown",
		"border": "clay",
		"borderAccent": "brown",
		"borderMuted": "clay",
		"success": "forest",
		"error": "rust",
		"warning": "amber",
		"muted": "bark",
		"dim": "clay",
		"text": "ink",
		"thinkingText": "bark",

		"selectedBg": "selectedBg",
		"userMessageBg": "userMsgBg",
		"userMessageText": "ink",
		"customMessageBg": "customMsgBg",
		"customMessageText": "ink",
		"customMessageLabel": "plum",
		"toolPendingBg": "toolPendingBg",
		"toolSuccessBg": "toolSuccessBg",
		"toolErrorBg": "toolErrorBg",
		"warningBg": "warningBg",
		"toolTitle": "ink",
		"toolOutput": "bark",

		"mdHeading": "amber",
		"mdLink": "indigo",
		"mdLinkUrl": "clay",
		"mdCode": "teal",
		"mdCodeBlock": "inkSoft",
		"mdCodeBlockBorder": "clay",
		"mdQuote": "bark",
		"mdQuoteBorder": "brown",
		"mdHr": "clay",
		"mdListBullet": "brown",

		"toolDiffAdded": "forest",
		"toolDiffRemoved": "rust",
		"toolDiffContext": "clay",

		"syntaxComment": "forest",
		"syntaxKeyword": "indigo",
		"syntaxFunction": "brown",
		"syntaxVariable": "plum",
		"syntaxString": "rust",
		"syntaxNumber": "teal",
		"syntaxType": "amber",
		"syntaxOperator": "inkSoft",
		"syntaxPunctuation": "inkSoft",

		"thinkingOff": "clay",
		"thinkingMinimal": "bark",
		"thinkingLow": "indigo",
		"thinkingMedium": "teal",
		"thinkingHigh": "brown",
		"thinkingXhigh": "plum",

		"bashMode": "forest",

		"agent1": "#023636",
		"agent2": "#8a1c00",
		"agent3": "#382905",
		"agent4": "#570038",
		"agent5": "#1b5303",
		"agent6": "#004080",
		"mcp": "#7307a2"
	},
	"export": {
		"pageBg": "#fffdf7",
		"cardBg": "#fffefa",
		"infoBg": "#fff0c2"
	}
}
