{
	"$schema": "https://raw.githubusercontent.com/kolisachint/hoocode-ts/main/packages/coding-agent/src/modes/interactive/theme/theme-schema.json",
	"name": "deep-space",
	"description": "Mission Control deep-space navy void",
	"vars": {
		"accent": "#5ce1e6",
		"cyan": "#5ce1e6",
		"vio": "#9b8cff",
		"ink": "#e6ecff",
		"gray": "#7d87a6",
		"dimGray": "#7d87a6",
		"darkGray": "#3a4462",
		"green": "#7ee081",
		"red": "#ff5c7a",
		"yellow": "#ffb547",
		"gold": "#ffd76a",
		"magenta": "#ff7ad9",
		"blue": "#6e93ff",
		"edge": "#1a2340",
		"comment": "#a0a7bd",
		"kw": "#b7a8ff",
		"fn": "#8af0f3",
		"selectedBg": "#0d1328",
		"userMsgBg": "#141432",
		"customMsgBg": "#1e1a28",
		"toolPendingBg": "#0b1124",
		"toolBandBg": "#0d1328",
		"toolSuccessBg": "#0e2418",
		"toolErrorBg": "#2b1020",
		"warningBg": "#2a230d"
	},
	"colors": {
		"accent": "accent",
		"border": "edge",
		"borderAccent": "cyan",
		"borderMuted": "darkGray",
		"success": "green",
		"error": "red",
		"warning": "yellow",
		"muted": "gray",
		"dim": "dimGray",
		"text": "ink",
		"thinkingText": "dimGray",
		"selectedBg": "selectedBg",
		"userMessageBg": "userMsgBg",
		"userMessageText": "ink",
		"customMessageBg": "customMsgBg",
		"customMessageText": "ink",
		"customMessageLabel": "vio",
		"toolPendingBg": "toolPendingBg",
		"toolSuccessBg": "toolSuccessBg",
		"toolErrorBg": "toolErrorBg",
		"toolBandBg": "toolBandBg",
		"warningBg": "warningBg",
		"toolTitle": "",
		"toolOutput": "gray",
		"mdHeading": "gold",
		"mdLink": "cyan",
		"mdLinkUrl": "dimGray",
		"mdCode": "accent",
		"mdCodeBlock": "green",
		"mdCodeBlockBorder": "gray",
		"mdQuote": "gray",
		"mdQuoteBorder": "gray",
		"mdHr": "darkGray",
		"mdListBullet": "accent",
		"toolDiffAdded": "green",
		"toolDiffRemoved": "red",
		"toolDiffContext": "gray",
		"syntaxComment": "comment",
		"syntaxKeyword": "kw",
		"syntaxFunction": "fn",
		"syntaxVariable": "cyan",
		"syntaxString": "green",
		"syntaxNumber": "gold",
		"syntaxType": "cyan",
		"syntaxOperator": "ink",
		"syntaxPunctuation": "dimGray",
		"thinkingOff": "darkGray",
		"thinkingMinimal": "dimGray",
		"thinkingLow": "vio",
		"thinkingMedium": "accent",
		"thinkingHigh": "yellow",
		"thinkingXhigh": "magenta",
		"bashMode": "green",
		"agent1": "accent",
		"agent2": "vio",
		"agent3": "gold",
		"agent4": "magenta",
		"agent5": "green",
		"agent6": "blue",
		"mcp": "magenta",
		"ink": "ink",
		"faint": "darkGray",
		"acc": "accent",
		"ok": "green",
		"err": "red",
		"warn": "yellow",
		"you": "vio",
		"vio": "vio",
		"gold": "gold"
	},
	"export": {
		"pageBg": "#05070f",
		"cardBg": "#0b1020",
		"infoBg": "#121a33"
	}
}
