{
	"$schema": "https://raw.githubusercontent.com/kolisachint/hoocode/main/packages/coding-agent/src/modes/interactive/theme/theme-schema.json",
	"name": "vox-dark",
	"description": "Explanatory-journalism yellow on newsprint black; warning moves to orange so yellow stays the accent",
	"vars": {
		"paper": "#f4f1e6",
		"yellow": "#ffe600",
		"orange": "#ff9f1c",
		"green": "#5fd08a",
		"red": "#ff7b68",
		"blue": "#7fc0ff",
		"teal": "#5fd6cd",
		"purple": "#d7a8ff",
		"muted": "#a9a496",
		"dim": "#8f8b7c",
		"rule": "#7d786a",
		"ruleMuted": "#726d5e",
		"selectedBg": "#282412",
		"userMsgBg": "#1c1b17",
		"customMsgBg": "#221c26",
		"toolPendingBg": "#1a1915",
		"toolSuccessBg": "#15201a",
		"toolErrorBg": "#271512",
		"warningBg": "#2c2111"
	},
	"colors": {
		"accent": "yellow",
		"border": "rule",
		"borderAccent": "yellow",
		"borderMuted": "ruleMuted",
		"success": "green",
		"error": "red",
		"warning": "orange",
		"muted": "muted",
		"dim": "dim",
		"text": "paper",
		"thinkingText": "muted",

		"selectedBg": "selectedBg",
		"userMessageBg": "userMsgBg",
		"userMessageText": "paper",
		"customMessageBg": "customMsgBg",
		"customMessageText": "paper",
		"customMessageLabel": "purple",
		"toolPendingBg": "toolPendingBg",
		"toolSuccessBg": "toolSuccessBg",
		"toolErrorBg": "toolErrorBg",
		"warningBg": "warningBg",
		"toolTitle": "paper",
		"toolOutput": "muted",

		"mdHeading": "yellow",
		"mdLink": "blue",
		"mdLinkUrl": "dim",
		"mdCode": "teal",
		"mdCodeBlock": "#a7c894",
		"mdCodeBlockBorder": "rule",
		"mdQuote": "muted",
		"mdQuoteBorder": "rule",
		"mdHr": "rule",
		"mdListBullet": "yellow",

		"toolDiffAdded": "green",
		"toolDiffRemoved": "red",
		"toolDiffContext": "dim",

		"syntaxComment": "#7f9e73",
		"syntaxKeyword": "#8fb8e8",
		"syntaxFunction": "#e8d48f",
		"syntaxVariable": "#d9c6f0",
		"syntaxString": "#e2a07a",
		"syntaxNumber": "#b9d3a4",
		"syntaxType": "teal",
		"syntaxOperator": "#d8d2c4",
		"syntaxPunctuation": "#d8d2c4",

		"thinkingOff": "#726d5e",
		"thinkingMinimal": "#9a9581",
		"thinkingLow": "#6a8fbf",
		"thinkingMedium": "#7fb3d5",
		"thinkingHigh": "#b294bb",
		"thinkingXhigh": "#d183e8",

		"bashMode": "green",

		"agent1": "teal",
		"agent2": "purple",
		"agent3": "#ffb865",
		"agent4": "#ff9ec4",
		"agent5": "#7fd6a8",
		"agent6": "#8fb8e8",
		"mcp": "#d0b0a0"
	},
	"export": {
		"pageBg": "#111110",
		"cardBg": "#191813",
		"infoBg": "#282412"
	}
}
